{
  "id": "journey-no-preferred-true-next",
  "description": "No preferred target → unpinned hero equals true next.",
  "tags": ["journey", "preferred"],
  "clock": {
    "perthDateKey": "2026-08-15",
    "nowIso": "2026-08-15T06:00:00+08:00"
  },
  "input": {
    "mode": "journey",
    "journeyModeActive": true,
    "skipTrains": 0,
    "journey": {
      "id": "j-fixture-4",
      "station": "Edgewater Stn",
      "direction": "Perth",
      "defaultFrom": "00:00",
      "defaultUntil": "23:59",
      "leaveBeforeMinutes": 10,
      "useLeaveBefore": true
    },
    "payload": {
      "next": {
        "departure": "2026-08-15T06:30:00+08:00",
        "displayTime": "6:30",
        "platform": "1"
      },
      "upcoming": [
        {
          "departure": "2026-08-15T06:30:00+08:00",
          "displayTime": "6:30",
          "platform": "1"
        },
        {
          "departure": "2026-08-15T07:00:00+08:00",
          "displayTime": "7:00",
          "platform": "2"
        }
      ]
    }
  },
  "expected": {
    "trueNextDeparture": "2026-08-15T06:30:00+08:00",
    "pinDeparture": null,
    "heroDeparture": "2026-08-15T06:30:00+08:00",
    "leaveDeparture": "2026-08-15T06:30:00+08:00",
    "secondaryNextDeparture": null,
    "widgetFaceDeparture": null,
    "isPinnedToday": false,
    "heroShowsPin": false,
    "isOverrideActiveToday": false,
    "isPinDismissedToday": false,
    "isSkipPreview": false,
    "isHeroPinLockingSwipe": false,
    "showSecondaryNext": false,
    "leaveCardArmed": false,
    "heroLabel": "Next Train"
  }
}
