{
  "id": "journey-override-stale-date",
  "description": "Override from yesterday is ignored; preferred pin applies.",
  "tags": ["journey", "override", "preferred"],
  "clock": {
    "perthDateKey": "2026-08-15",
    "nowIso": "2026-08-15T06:00:00+08:00"
  },
  "input": {
    "mode": "journey",
    "journeyModeActive": true,
    "skipTrains": 0,
    "journey": {
      "id": "j-fixture-7",
      "station": "Edgewater Stn",
      "direction": "Perth",
      "preferredTrainTime": "07:30",
      "journeyPinOverrideDate": "2026-08-14",
      "journeyPinOverrideIso": "2026-08-14T07:45:00+08:00",
      "defaultFrom": "00:00",
      "defaultUntil": "23:59",
      "leaveBeforeMinutes": 10,
      "useLeaveBefore": true
    },
    "payload": {
      "next": {
        "departure": "2026-08-15T06:30:00+08:00",
        "displayTime": "6:30",
        "platform": "1"
      },
      "upcoming": [
        {
          "departure": "2026-08-15T06:30:00+08:00",
          "displayTime": "6:30",
          "platform": "1"
        },
        {
          "departure": "2026-08-15T07:30:00+08:00",
          "displayTime": "7:30",
          "platform": "1"
        }
      ]
    }
  },
  "expected": {
    "trueNextDeparture": "2026-08-15T06:30:00+08:00",
    "pinDeparture": "2026-08-15T07:30:00+08:00",
    "heroDeparture": "2026-08-15T07:30:00+08:00",
    "leaveDeparture": "2026-08-15T07:30:00+08:00",
    "secondaryNextDeparture": "2026-08-15T06:30:00+08:00",
    "widgetFaceDeparture": "2026-08-15T07:30:00+08:00",
    "isPinnedToday": true,
    "heroShowsPin": true,
    "isOverrideActiveToday": false,
    "isPinDismissedToday": false,
    "isSkipPreview": false,
    "isHeroPinLockingSwipe": false,
    "showSecondaryNext": true,
    "leaveCardArmed": true,
    "heroLabel": "Target train"
  }
}
