{
  "id": "nearby-pin-holding",
  "description": "Near me pin hold shows pinned departure on hero; true next may differ.",
  "tags": ["nearby"],
  "clock": {
    "perthDateKey": "2026-08-15",
    "nowIso": "2026-08-15T06:00:00+08:00"
  },
  "input": {
    "mode": "nearby",
    "nearbyModeActive": true,
    "skipTrains": 0,
    "nearbyPin": {
      "station": "Edgewater Stn",
      "direction": "Perth",
      "departureIso": "2026-08-15T07:00:00+08:00",
      "displayTime": "7:00",
      "platform": "2",
      "holdingUntilMs": 1786837200000
    },
    "payload": {
      "next": {
        "departure": "2026-08-15T06:30:00+08:00",
        "displayTime": "6:30",
        "platform": "1"
      },
      "upcoming": [
        {
          "departure": "2026-08-15T06:30:00+08:00",
          "displayTime": "6:30",
          "platform": "1"
        },
        {
          "departure": "2026-08-15T07:00:00+08:00",
          "displayTime": "7:00",
          "platform": "2"
        }
      ]
    }
  },
  "expected": {
    "trueNextDeparture": "2026-08-15T06:30:00+08:00",
    "pinDeparture": "2026-08-15T07:00:00+08:00",
    "heroDeparture": "2026-08-15T07:00:00+08:00",
    "leaveDeparture": "2026-08-15T07:00:00+08:00",
    "secondaryNextDeparture": "2026-08-15T06:30:00+08:00",
    "widgetFaceDeparture": "2026-08-15T07:00:00+08:00",
    "isPinnedToday": true,
    "heroShowsPin": true,
    "isOverrideActiveToday": false,
    "isPinDismissedToday": false,
    "isSkipPreview": false,
    "isHeroPinLockingSwipe": true,
    "showSecondaryNext": true,
    "leaveCardArmed": true,
    "heroLabel": "Pinned Train"
  }
}
